{
  "schema_version": "thin-harness-ordinary-ci-receipt/v1",
  "pull_request_number": 2,
  "run_id": "9001",
  "run_attempt": 1,
  "head_sha": "__HEAD_SHA__",
  "base_sha": "__BASE_SHA__",
  "checkout_sha": "__HEAD_SHA__",
  "job_id": "__JOB_ID__",
  "check_name": "__CHECK_NAME__",
  "outcome": "success",
  "created_at_utc": "2026-08-06T00:00:00Z"
}
